"rating-other-user-rating","point-scale","title","title href","display-name-link","display-name-link href","review-date","text","actions"
"9","/10","This movie gets the most crap and the hate for it, it is solid decent action sci-fi film my second favorite in the franchise","https://www.imdb.com/review/rw4634279/?ref_=tt_urv","NightmareOnElmStreetFan","https://www.imdb.com/user/ur98240498/?ref_=tt_urv","8 February 2019","This movie gets the most crap and the hate for it, it is a solid decent action sci-fi film so what's the problem? It is a decent film I love the film. I would put it in my second favorite Jurassic Park film in the franchise. I know I am going to get a lot of hate because it is not a rant. In my opinion it is a good film I love it, if you hate the film is your opinion I have no problems with the film, but it is an improvement over Jurassic World I hated that film. Chris Pratt and Bryce Dallas Howard returns and they are decent I love them in the film so much.When the island's dormant volcano begins roaring to life, Owen and Claire mount a campaign to rescue the remaining dinosaurs from this extinction-level event.I enjoy the practical effects, the explosions, the acting, the story and the action. I love the CGI effect for the raging volcano This is a faster paced film it goes fast around. I enjoyed the film it was entertaining and I wasn't bored with it. I understand the story, the twist and what they try to do with the film. I got this movie on Blu-ray disc and I enjoy it, I enjoy the film it is a guilty pleasure of mine. Call it whatever you want it I love it.Chris Pratt as Owen Grady was decent and really a good hero, he does good performance, he has more stuff to do than in the first one. Bryce Dallas Howard as Claire Dearing was one hot mama who showed emotions and she cared about dinosaurs and a rescue mission. She wasn't annoying she was fine and entertaining. I like Bryce Dallas Howard because she was in Spider-Man 3 as Gwen Stacy and I have enjoyed her performance more than Emma Stone in The Amazing Spider-Man 1 and 2. I enjoy Ted Levine in this movie he was in Joy Ride and The Hills Have Eyes remake and I enjoy his performance to be a bad guy. I enjoyed Isabella Sermon as Maise little girl she wasn't annoying I liked her. Rafe Spall was awesome as Eli Mills the villain he was practically like Carter J. Burke (Paul Reiser) from Aliens who wanted a profit of capturing aliens while Mills try's to get rich by selling a live dinosaurs.CGi are better than in the previous movie and gets criticism for trying something different. At least this movie did not copy the first one or other movies like Jurassic World did. I love the first Jurassic Park to death it is the best one in the franchise by a novel who directed Steven Spielberg. I love Jurassic Park III and this one. Directed was by J. A. Bayona who made a good direction. I enjoy the film I would put the film between Aliens and Deep Rising the opening sequence is a really horror aspect, you see a man been eat by a sea monster. Derek Connolly and Colin Trevorrow wrote a script for the film and they did a good job Colin Trevorrow previously directed Jurassic World so I respect him.I love the idea the rescuing dinosaurs from raging volcano I thought was better idea then the Jurassic World did. The rescue mission was a ploy and Claire and Owen must try to save the dinosaurs from been sold on a black marked. The problems and dumb idea was the cloning little girl that was stupid and bad idea. Of course the T Rex- Veloceraptor blood transfusion was a bad idea too.My favorite scenes are in which Indoraptor hunts Owen and Maise throughout the mansion they are both on the roof but Claire shows up and distracts Indoraptor and of course Blue Velociraptor comes and saves them, kills prototype Indoraptor I loved that in the film. Jeff Goldblum has a cameo scene in the beginning of the film as Ian Malcolm and on the end of the film I don't mind him. BD Wong as Dr. Wu is also back as the bad guy he does a solid job. I love Claire and Franklin in an abandoned gyro-sphere to flee from the pyroclastic flow, but falls into the ocean that scene scared me because I thought they could have died for real. Excellent scene in the movie one of my favorites.I watch this movie twice in the row now, I know it is not perfect film it is not the greatest movie or the best one ever, I know it is stupid but I love it. I enjoy the film it is my second favorite film in the franchise. That is my opinion I forgot they mention a guy who is an arms dealer and they mention Slovenian my country yes I am from Slovenia so I am honored by this movie.","104 out of 176 found this helpful."
"10","/10","Loved it","https://www.imdb.com/review/rw4295993/?ref_=tt_urv","wingscannfly","https://www.imdb.com/user/ur30730803/?ref_=tt_urv","21 August 2018","Enjoyed it immensely. Loved the ending. A real treat and the acting was great.","198 out of 348 found this helpful."
"9","/10","Loved it - good old fashion Jurassic franchise","https://www.imdb.com/review/rw4271983/?ref_=tt_urv","jowen-17931","https://www.imdb.com/user/ur83113979/?ref_=tt_urv","6 August 2018","Spielberg references
Likeable characters
Some funny bits 
Tense bits
Unbelievable action sequences 
And Chris Pratt = good fun","62 out of 101 found this helpful."
"5","/10","Please just stop!","https://www.imdb.com/review/rw4794679/?ref_=tt_urv","vilchevski-03214","https://www.imdb.com/user/ur101967819/?ref_=tt_urv","21 April 2019","Please stop destroying this classic! It thought that Jurassic park 3 was bad ... the CGI on this is amazing, but everything else is a big flop. The plot is just stupid, the cast, apart from Chris Pratt, is awfull. It is 100% clear that this movie was made for milking money off of a once great movie.","3 out of 5 found this helpful."
"3","/10","big letdown","https://www.imdb.com/review/rw8525477/?ref_=tt_urv","darapjohnson","https://www.imdb.com/user/ur107935027/?ref_=tt_urv","8 September 2022","""Jurassic World: Fallen Kingdom"" was such a big letdown especially since (i'm not going to lie) the first one was pretty decent. There's literally nowhere I can point and say ""Yes, that's a good scene"". It was all just... under midJurassic World: Fallen Kingdom is where Jurassic World started declining rapidly. I mean what even was this? Absolute disgrace to the Jurassic Park/world franchise. People came for dinosaurs, instead we get explosions and spliced dinos and what not (Even though I sort of liked the Indominus Rex) but man, only watch this if you're really bored, else maybe skip this one because it's really under mid and that's being generous.","3 out of 5 found this helpful."
"10","/10","Excellent Movie","https://www.imdb.com/review/rw4205035/?ref_=tt_urv","oreilly44","https://www.imdb.com/user/ur35386532/?ref_=tt_urv","16 June 2018","Great Story. Great Movie. Thoroughly enjoyable. Characters and Acting are on point. Well worth taking the family out to watch it. Good Fun.","139 out of 240 found this helpful."
"4","/10","Dumbing down","https://www.imdb.com/review/rw4792671/?ref_=tt_urv","kittenkongshow","https://www.imdb.com/user/ur3101981/?ref_=tt_urv","20 April 2019","In the 25 years since the original classic cinema has truly dumbed down. Jurassic Park holds together well even the early use of CGI (It's in my opinion still better than a lot of the CGI in this!).Sadly the script is poor trying for scale over substance there are so many frankly dumb moments that happen because they happen logic be damned that you end up with the cinematic equivalent of bashing your head against a brick wall.","3 out of 5 found this helpful."
"5","/10","One line and disappointment","https://www.imdb.com/review/rw4204175/?ref_=tt_urv","strike-1995","https://www.imdb.com/user/ur25694706/?ref_=tt_urv","15 June 2018","Unfortunately the filmakers have lost sight of what made the original Jurassic park so brilliant.","3 out of 5 found this helpful."
"9","/10","FALLEN KINGDOM","https://www.imdb.com/review/rw4195027/?ref_=tt_urv","iamarnold","https://www.imdb.com/user/ur73931764/?ref_=tt_urv","8 June 2018","A million years ago, Dinosaurs faced extinction and nobody was there for them. Jurassic Park gave them a second chance. Three years after it's shut down, a new team is recruited to rescue the remaining species in the Isla Nubler island. And this time these creatures find their savior in human greed. The opening scene itself gave a lot of nostalgic vibes. Jurassic World 2 is contained with a lot from Jurassic Park trilogy. It's impossible for a fan to miss those. There are many moments that extensively feel like throwbacks from Jurassic Park movies.
Chris Pratt and Bryce Dallas Howard again proved to be a fantastic cast. 
But for a sequel, you expect something larger. Fallen Kingdom's huge canvas became narrow as the story carried on. This time you're not getting a mega dino adventure but the movie is as thrilling as it's precursors. 
Maybe because I grew up watching practical dinosaurs, I find some of the CGI shots very sluggish and weird. Making a creature with the use of computer is a mammoth task and they still haven't found the proper formula. The effects of raptor are terrifically puppeteer-ed. The volcanic eruption is brilliantly choreographed. 
The narrative was very much drawn to the use of music. The climax portion has some intense rhythms to up the tension. The thing is they can make ten other Jurassic movies about dinosaurs running unleashed and I'll happily sit and watch all of them. I love Dinosaurs.","107 out of 182 found this helpful."
"4","/10","Disappointed (no spoilers)","https://www.imdb.com/review/rw4407707/?ref_=tt_urv","leandrogroh","https://www.imdb.com/user/ur80780317/?ref_=tt_urv","19 October 2018","Watching that movie was a disgrace to everything I have watched and loved from the Steven Spielberg franchises... I am not gonna spoil the movie, but it had moments in which I asked myself: ""Did they really just go that way?!"" The CGI was horrific, just brilliant!!! But the plot completely went down the drain...I don't know what to say...Even some of the special effects had trouble to portray the physics of our planet.....That's why to me it's a 4/10","3 out of 5 found this helpful."
"10","/10","My Favorite Since Jurassic Park","https://www.imdb.com/review/rw4192898/?ref_=tt_urv","PoisonKeyblade","https://www.imdb.com/user/ur7752337/?ref_=tt_urv","6 June 2018","Three years ago, we were gifted with the new franchise entry Jurassic World, a film that broke records and stole my heart. It was a beautiful love letter to the original films, deeply rooted in nostalgia, but it also amped up the action and gave us a new set of characters to fall in love with. I loved every minute of it, and never wanted it to end.Jurassic World: Fallen Kingdom is a completely new monster. This carries the basic DNA of what we expect from a Jurassic movie, but takes it to crazy new heights, relying very little on nostalgia or setup from earlier installments. New director J.A. Bayona brings a new perspective to the sweeping action set pieces and a dark, riveting tone that isn't present in any of the other franchise entries. The ensemble cast, including Chris Pratt's charismatic Owen Grady, Bryce Dallas Howard's Claire Dearing, and (my personal favorite) newcomer Isabella Sermon's Maisie Lockwood, all bring something to the table that fits together in a nice cohesive way thanks to a lot of onscreen chemistry. Maisie is the anchor of film's twisty story, and she is just downright adorable unlike some of the annoying children this series is known for. Depending on how you look at it, the real stars are the dinosaurs and special effects, which are the best they've ever been. This one feels like a love letter to the dinosaurs themselves in more than one respect. Best of all, though: this might be my favorite sequel since the original Jurassic Park.The opening sequence alone made me fall in love with the film almost immediately, already setting up the scarier tone and feel. This movie has such a large scope that it dwarfs any other Jurassic film in that way. It just feels bigger, and of course it's extremely entertaining. The action pace is nonstop, but Bayona also gifts us with beautiful and tender shots (there's one in particular that broke my heart) and great character beats. The claustrophobic setting of the film's second half is atmospheric gothic horror meets creature feature. It's something I never thought I would say about any Jurassic film, but it felt exciting and new and certainly nothing like what we've seen previously.Fallen Kingdom is a dark, explosive blockbuster that takes the series in an exciting new direction and I absolutely loved it. It expands the scope of the series in such a way that it feels like there is so much more story left to tell here. I can't wait to see it again, and I can't wait to see where this series will go next.","130 out of 224 found this helpful."
"10","/10","Surprised me","https://www.imdb.com/review/rw4231219/?ref_=tt_urv","teaghann","https://www.imdb.com/user/ur25538678/?ref_=tt_urv","9 July 2018","I expected something generic but fun to watch, and this was so much more than that. I felt so many emotions. I actually had tears in my eyes at times. This movie made you really feel for the dinosaurs. I actually loved it. It has a lot more depth than the first of the new series. I enjoyed that one also... but that movie was mainly a funny action-adventure movie. This movie while still containing the humor and action-adventure aspects, is deeper and darker. I'm surprised the rating isn't higher.","125 out of 215 found this helpful."
"10","/10","Totally awesome","https://www.imdb.com/review/rw4212880/?ref_=tt_urv","astarrydream","https://www.imdb.com/user/ur27071161/?ref_=tt_urv","23 June 2018","I have been a fan of dinosaur movies for 25 years and I rate them all 10 stars. I just cannot wait for the DVD","68 out of 112 found this helpful."
"9","/10","Just saw it!","https://www.imdb.com/review/rw4211693/?ref_=tt_urv","rn-51537","https://www.imdb.com/user/ur75355146/?ref_=tt_urv","22 June 2018","Great movie with lots of action and dinosaurs. My kids loved it and it was extremely entertaining. Not to mention, it's got Chris Pratt. I would see it again.","73 out of 121 found this helpful."
"8","/10","The entertainment that never fails.","https://www.imdb.com/review/rw4322982/?ref_=tt_urv","patriciogl10","https://www.imdb.com/user/ur5921267/?ref_=tt_urv","5 September 2018","I know that Jurassic World: Fallen Kingdom's plot leaves a lot to be desired; especially concerning the purpose the evil guys want to give the dinos, that is turning them into war machines; so far fetched that one inevitably thinks that they have really not thought this through at all. Many people think that this is a rehash of The Lost World, and in certain ways it is because of the fact that humans are taking the dinosaurs to the 'real world'; nevertheless this movie has a totally different vibe and can stand up on its own merit. All plot issues aside, this movie never fails to entertain, which is the first thing I look for in
this kind of films, and especially the Jurassic Park movie franchise. The acting is good, no one seems to be out of tune; there is a fairly good chemistry between Chris Pratt and the always gorgeous Bryce Dallas Howard, however in the previous movie they had more serious romantic interactions between them. What happens is that in Fallen Kingdom the action and the primary plot starts to develop quickly from minute one and it virtually doesn't stop. I find that to be one of the good things about this film, you don't have to wait for the events to be set in motion, they already are at full blast. As a fan of the original Jurassic Park, I loved the inclusion of Jeff Goldblum as Dr. Ian Malcolm even if it doesn't come from the center of the action. Toby Jones does a fair job as the evil rich eccentric man; Isabella Sermon plays Maisie Lockwood (Benjamin Lockwood's granddaughter), because it's not a Jurassic Park/World movie if it doesn't include children. The supporting characters Zia (Daniella Pineda) and Franklin (Justice Smith) spend most of the film apart from the leads which I thought that it was a different but acceptable approach, since they proved themselves useful nonetheless. Rafe Spall (Eli Mills) as the main antagonist in my opinion was passable. He wasn't too great nor plain bad, just okay. Maybe he lacked a bit of evilness.As for the dinos, they looked great, particularly the animatronics. They always give such a genuine look sometimes overdone by CGI. The relationship between Blue and Owen reaches new heights; it falls to a deeper emotional level where we actually find ourselves rooting for her. Oh, and there's a new dino in town, a hybrid between the Indominus Rex and a Velociraptor. This new addition, the Indoraptor, doesn't appear fully in picture until the third act more or less. While in Jurassic World the main attraction was the Indominous Rex and appeared from the beginning, the Indoraptor is only revealed later on; and it proves to be a highly menacing creature.All things considered, I found the entertainment I came looking for; I'm aware of certain plot flaws but that can't take away the fact that I had a blast watching this movie, and sometimes you have to put that first, but many people seem to discard that by looking for infallible logic in a hugely popular dinosaur movie franchise. I mean come on. If you're like me, this action-packed adventure will not disappoint you. On a side note: should we start saying ""is not a Jurassic World film if the Mosasaurus doesn't jump out of the water to eat a person?"" or is it too soon? But I think I'm noticing a trend here. I just wish the filmmakers would give the Mosasaurus a much bigger involvement.","39 out of 61 found this helpful."
"3","/10","It's completely enjoyable...if you can accept the fact that it's just another lame, typical Jurassic Park sequel","https://www.imdb.com/review/rw4212671/?ref_=tt_urv","Gresh854","https://www.imdb.com/user/ur40127150/?ref_=tt_urv","23 June 2018","My feelings towards Jurassic World Fallen Kingdom are essentially the same as mine on the previous Jurassic World. They're both senselessly enjoyable, and you can have fun watching them. However, they bring nothing authentic or refreshing to the franchise and are ultimately just typical, mediocre summer blockbusters. The Jurassic Park series deserves miles better than this. (Verdict: C)","4 out of 8 found this helpful."
"2","/10","one of the worst adventure scripts ever written","https://www.imdb.com/review/rw4717004/?ref_=tt_urv","MLDinTN","https://www.imdb.com/user/ur1773414/?ref_=tt_urv","11 March 2019","I don't know how this script got a go ahead. It's terrible and this is by far the worst movie in the Jurassic Park franchise. The action scenes are awful because they are so unbelievable. Like in the beginning, when Owen and Claire go to the dinosaur island and the volcano explodes. First Owen is paralyzed, yet comes around right when the lava is mere inches away. Then when he is running from the volcano blast, some how he can out run it, when the dinosaurs can't. And he can hold is breathe long enough to get Claire and Franklin out of the bubble. Then the launch of the truck to make the boat as its leaving. That was impossible. Then you have the one dimensional villain whom wants to sell the dinosaurs. And of the course the ending, no one would have made that decision. I guess in the sequel the US mainland will be a dino kill zone.FINAL VERDICT: Even the special effects can't save this movie. It's too bad. If you are over the age of 12, don't watch this.","4 out of 8 found this helpful."
"10","/10","Loved it!!","https://www.imdb.com/review/rw4300278/?ref_=tt_urv","lindyloo395","https://www.imdb.com/user/ur24833486/?ref_=tt_urv","23 August 2018","Really honestly enjoyed this movie! Dont know why so much negativity.","197 out of 348 found this helpful."
"9","/10","Good time, fun action and doesn't drag","https://www.imdb.com/review/rw4198489/?ref_=tt_urv","thomashem","https://www.imdb.com/user/ur78267947/?ref_=tt_urv","10 June 2018","I'm seeing lots of negative reviews for this with people comparing it to 'Jurassic Park'. I don't know what you're expecting from a dinosaur movie in 2018 but it will never top 'Jurassic Park'. Now I'm doing what you all should be doing and compare it to 'Jurassic world'. Overall I enjoyed it more. The action was great, the claustrophobic feel of the mansion gave the movie something original and the scenes on the island were enough.The indoraptor, i thought was better than the indominous Rex just because of the look and creepy feel. CGI looks a lot better than last time, but the crowning achievement in effects, has to be the animatronics used. Overall it's not the best film ever made but go into it just wanting to have fun. Nothing will ever too the original and try to think of this as what it is, A REBOOT SERIES.Btw the opening scene is amazing.","94 out of 159 found this helpful."
"1","/10","Å sloppy mishmash rerun","https://www.imdb.com/review/rw4333473/?ref_=tt_urv","pmel63","https://www.imdb.com/user/ur19922360/?ref_=tt_urv","11 September 2018","Though set in a partly new environment and in spite of the actors' efforts, the scenes accomplish only flash backs to previous movies in the series.","4 out of 8 found this helpful."
"10","/10","The Park Is Gone","https://www.imdb.com/review/rw5826475/?ref_=tt_urv","dickinsonjason-34081","https://www.imdb.com/user/ur111479521/?ref_=tt_urv","15 June 2020","This One was very good I loved it it was a lot fun from start to finish","89 out of 150 found this helpful."
"1","/10","Save yourself some time","https://www.imdb.com/review/rw4842024/?ref_=tt_urv","phillipe-obrien","https://www.imdb.com/user/ur36454008/?ref_=tt_urv","11 May 2019","Don't bother watching this. I'm loved The original but this was by far the most unwatchable movie of the lot. I have no idea why some people rate this so highly. Only a couple of likable characters, awful plot, and you only feel bad bad for the dinosaurs. My advice would be to rewatch the original rather than waste time watching this.","4 out of 8 found this helpful."
"8","/10","WTH? This was a fun movie!","https://www.imdb.com/review/rw4221411/?ref_=tt_urv","rifleman-04939","https://www.imdb.com/user/ur89585576/?ref_=tt_urv","1 July 2018","Why all the negative Nancys??? The acting was good and I really enjoyed it. It's a big budget Hollywood movie and not intended to be a Citizen Cane.","32 out of 49 found this helpful."
"5","/10","Another ""Jurassic"" Meh.","https://www.imdb.com/review/rw4211191/?ref_=tt_urv","travishouze","https://www.imdb.com/user/ur32464514/?ref_=tt_urv","21 June 2018","Jurassic World and it's follow up Fallen Kingdom are both so aggressively ""meh"" that it amazes me that its become the phenomenon its been lately. The film takes place after the disaster of Jurassic World being overrun by dinosaurs and money hungry men in suits, as they try to retrieve several of the dinosaurs from the park. But to no one's surprise, we find out soon enough the men in suits are using the rescue op as a chance to snatch up the dinosaurs and sell them as predators.The film almost exclusively takes place in only 2 locations, the island and this insanely large estate. The moments in the park go by so fast that we are out of the park only 50 minutes into this 2 hour film. For people here to see Jeff Goldblum, he's literally only in the movie for one scene of exposition. His moments are so detached from what else is happening, you could edit him out and the movie wouldn't be affected. There's also a scene involving Chris Pratt outrunning a valance eruption, and it's as ridiculous as it sounds.Its not all bad, as some of it's horror like tone helps with the of the tension in some moments, particularly one moment that involves reflection and shadows really nicely. There are some moments when Blue, the raptor is fighting with one of the dinosaurs that gets pretty nice to watch. There are some moments where the dinosaurs are attempted to give them distinct personalities and a bit of moral conflict is woven into the plot.My biggest issue with the Jurassic World franchise so far is it thinks you are more invested with the characters than you really are. This film made me wonder if there is any where else this franchise can even go, as I feel it's told me the same things already. Here's hopes JW3 is more interesting, but so far, the needle in my mind has yet to be moved.Rating: 4.7 / 10","4 out of 8 found this helpful."
"5","/10","One line and disappointment","https://www.imdb.com/review/rw4204176/?ref_=tt_urv","strike-1995","https://www.imdb.com/user/ur25694706/?ref_=tt_urv","15 June 2018","Unfortunately the filmakers have lost sight of what made the original film so brilliant.","4 out of 8 found this helpful."
