"rating-other-user-rating","point-scale","title","title href","display-name-link","display-name-link href","review-date","text","actions"
"5","/10","Dinosaurs everywhere! And everyone's even stupider than last time.","https://www.imdb.com/review/rw4251611/?ref_=tt_urv","Johnny-the-Film-Sentinel-2187","https://www.imdb.com/user/ur24085266/?ref_=tt_urv","24 July 2018","Jurassic World has that old-timey disaster movie vibe where all the characters whom inhabit the movie are there solely to be killed (with the exception of the sacred main characters of course). This movie is populated with set-piece puppets who serve no other purpose other than to be killed in rather dumb fashion or shown to have outright questionable 'sense' of things ultimately leading them to their deaths. 
Fallen Kingdom is an unnecessary continuation of a nostalgic franchise because who would want to continue preserving creatures who'd threaten the fabric of our modern society? At least Star Wars had the logic of having remnants of an old empire reform generations later as opposed to scientists playing god for failed theme parks!Fallen Kingdom isn't terrible but it's not really all that good either. While it's got some nice effects throughout, the overall package equates to boring characters who don't compare to the interest we have in the dinosaurs at all.2.5/5 stars.","30 out of 52 found this helpful."
"10","/10","Still keeps the Jurassic vibe alive","https://www.imdb.com/review/rw4270098/?ref_=tt_urv","sllindroos","https://www.imdb.com/user/ur90897084/?ref_=tt_urv","5 August 2018","My expectations were sky high when i got to the cinema. And whem I walked out of there i was stoked. I have only possitive thoughts about this movie.","65 out of 101 found this helpful."
"6","/10","on par with Jurassic Park 3","https://www.imdb.com/review/rw4719650/?ref_=tt_urv","Mynameisroman","https://www.imdb.com/user/ur37155757/?ref_=tt_urv","13 March 2019","In a lot of ways the movie starts like Jurassic Park 2. A lot of parallels in the story. but it adds a lot of new stuff to the story so its not too close to the second movie. But although i really liked Jurassic Park 2, this one here has a lot of problems. A lot of people make really stupid decisions that are not rational. decisions that are so stupid, you only do them because it was written in the script. no sane human being would do that. and those bad decisions just to move the story forward really destroys the movie in many ways. otherwise the special effects are great and you get some decent action here and there. its fun to watch once and never again.","2 out of 3 found this helpful."
"3","/10","disappointed","https://www.imdb.com/review/rw4217315/?ref_=tt_urv","angel_osvaldo_m","https://www.imdb.com/user/ur40264304/?ref_=tt_urv","27 June 2018","Worst movie from the saga, some of
the actor were kind of lame on their roles. movie has a lot of action but very bad story, honestly didnt like at all first 20 min were good became a very silly movie","32 out of 56 found this helpful."
"9","/10","Awesome Movie","https://www.imdb.com/review/rw4327222/?ref_=tt_urv","vascocorreia-82749","https://www.imdb.com/user/ur92242478/?ref_=tt_urv","8 September 2018","Like all other movies this one was very good. I will wait for the next.","65 out of 101 found this helpful."
"7","/10","Dinosaurs & Chris Pratt: what more do you need?","https://www.imdb.com/review/rw8227819/?ref_=tt_urv","athorpe-95303","https://www.imdb.com/user/ur147675497/?ref_=tt_urv","11 June 2022","Things I like: Dinosaurs, Chris Pratt, Dinosaurs & Chris Pratt.Things in this movie: Dinosaurs, Christ Pratt, Dinosaurs & Chris Pratt.Too bad the plot sucked.Def watching again.74/100.Same as No Way Home.#42Movie title and release year: Jurassic World: Fallen Kingdom, (2018)74/100, CReviewer name and watch date: Andrew Thorpe, 6/11/2022, Fri.1a - Attraction value - upon first contact, is the idea appealing?: 8/10
1b - Attraction value - cast, plot, series, other medium influence?: 8/10
2a - Acting - casting - lead, supporting, villain, etc: 10/15
2b - Acting - character interaction, emotional connection: 10/15
3a - Dialogue - use for moving plot forward, nuance: 6/10
3b - Dialogue - writing quality, profanity, comedy: 10/15
4a - Plot - logical within universe, easy to follow, makes sense: 10/15
4b - Plot - quality, is it a good plot? Too long, unique?:5/15
5a - Themes & motifs - symbolism, strong impressions: 6/15
5b - Themes & motifs - applicable ideas/thoughts, call to action: 1/5
6a - Cinematography - pace of editing, cuts, scene length, etc: 13/15
6b - Cinematography - angle, tone mood of shots: 13/15
7a - Effects - practical - explosions, large animals & vehicles: 5/5
7b - Effects - practical - costumes, weapons, props: 5/5
7c - Effects - practical - settings, scenery: 5/5
7d - Effects - special - CGI, green screen: 4/5
8a - Sound - score - conveying mood, determining attitude, etc: 15/20
8b - Sound - sound fx - foley, gunshots, explosions, dialogue, sound quality: 8/10
9a - Direction - quality - vision, concept, should this movie exist?: 8/10
9b - Direction - choices - execution of vision, cohesiveness: 10/15
10 - Bonus - up to 30 bonus points: 24/30Total out of 250: 184/250Instagram: @the_og_bigjoe
twitter: @the_og_bigjoe
letterboxd: @the_og_bigjoe.","2 out of 3 found this helpful."
"2","/10","The worse one yet","https://www.imdb.com/review/rw4226990/?ref_=tt_urv","mitchryder1953","https://www.imdb.com/user/ur34304792/?ref_=tt_urv","5 July 2018","Shouldn't of even made this. It's a stupid movie idea. Sort of like the second one with the hunters going to the island to hunt the dinosaurs. Probably why Sam Neil didn't do it. It's just a waste for 2:08 minutes. Sad parts dinosaurs dying on the island. Stupid at the end. Now we're going to have dinosaurs running all over the planet. Really? C'mon is that your story? Well it sucks.","34 out of 60 found this helpful."
"7","/10","My vison of Jurassic Park: Fallen Kingdom","https://www.imdb.com/review/rw4800484/?ref_=tt_urv","LacerdanGabriel","https://www.imdb.com/user/ur63680439/?ref_=tt_urv","24 April 2019","Jurassic World: Threatened Kingdom is the second film of the new Jurassic Park trilogy. It continues the universe of films begun in the 1990s with the first Jurassic Park, directed by Steven Spielberg, which has marked the history of cinema forever with its technologies developed to be produced.
As well as the first film of this new trilogy, Jurassic World of 2015, the new film rescues the nostalgic feeling of the classics. In a way, we are moving to the same narrative already seen before, but in an updated way for the new generations. But in the background following the same mechanics of the second film in the original trilogy, where the dinosaurs end up
civilization, outside the island where they were confined and thus causing the development of history. Although this time this happens in a new way and in keeping with the current society.
The play is clearly a popcorn movie that will age, but without losing the magic of having fun if viewed unpretentiously. It makes us feel the most diverse emotions, such as distress when seeing the dinosaurs fleeing, pity to see them dying to the point of causing crying, happiness in developing the adventure that at no time loses rhythm, always keeps the viewer entertained. And no
final leaves a wonderful ""taste of want more"", when it shows us what is to come in the wrapping of this new trilogy, also making us understand the title that was in our face from 2015.","2 out of 3 found this helpful."
"6","/10","Why should kids have all the fun?","https://www.imdb.com/review/rw9108015/?ref_=tt_urv","OnlyKSJ","https://www.imdb.com/user/ur28221037/?ref_=tt_urv","8 June 2023","*) K Reviews *) ( ( This movie could be wind up easily and ended at the lauch of Biosyn, then in the third, they could have explored more and made a sensfull movie. Whenever they Goa dn wherever they go, T-Rex always saves the hero, but why, that's a dinosaur and will eat you in a second do you should runaway, but instead of that, they were looking like they were going to hug that dinosaur like a puppy and kiss that thing goodbye. The theme of the T-Rex saving the hero regardless of where they go, despite the fact that it is a dangerous dinosaur that could easily harm them. It has the potential for more compelling and meaningful storytelling in a future instalment of the franchise.","2 out of 3 found this helpful."
"10","/10","JURASSIC WORLD: FALLEN KINGDOM IS AWESOME !","https://www.imdb.com/review/rw4253901/?ref_=tt_urv","gafriariansyah-37734","https://www.imdb.com/user/ur89569193/?ref_=tt_urv","26 July 2018","Jurassic World: Fallen Kingdom is fifth installment in Jurassic Park film series..This movie very awesome, great acting, great cgi, beautiful dinosaurs... This movie best film in Jurassic Park franchise !I loved it","62 out of 96 found this helpful."
"6","/10","Starting to overstay it's welcome, but still - dinosaurs!","https://www.imdb.com/review/rw4209703/?ref_=tt_urv","gavinp9","https://www.imdb.com/user/ur21319675/?ref_=tt_urv","20 June 2018","'Jurassic Park 5' starts pretty well, with the giant crocodile thing & sense of foreboding doom, as we're reintroduced to Isla Nublar and what's happened to the abandoned park in the last three years. Both Claire (Dallas Howard) & Owen (Pratt) are brought back in to help rescue the dinosaurs - basically it's a mash up of the plots of JP2 & JP3. My only wish for the film - we see dinosaurs kill over five humans...They try to bring back Ian Malcolm (Goldblum), but he's given far too little screen time, as are the new sidekicks - Franklin (Smith), Zia (Pineda) & Maisie (Sermon). You sort of get to know them, and then they're hardly used. The same could almost be said of Pratt, who almost seems a passenger in the film, basically phoning it in. Cromwell and Jones are likewise great actors underutilised. The only one who plays his part with relish is Eli (Spall), the profiteer. There's some good scenes - and a few frights done well where I had to clap - but overall, I'm left feeling that the film didn't really add anything to the franchise or story. Sure, we get to see plenty of dinosaurs (including a stegosaurus, yay!) for a few minutes, but mostly its's spent in a weird CGI-castle. The ""bad guy"" is another genetically-improved raptor (didn't that happen last film?) and there's plenty of what I'm sure the director hopes are call-backs, but just seem lazy. I don't like how they only pull out the T. Rex when convenient. Still, there was at least 10 people eaten by dinosaurs, so it's not all bad...","2 out of 3 found this helpful."
"3","/10","Save your money, go watch Jurassic Park","https://www.imdb.com/review/rw4219342/?ref_=tt_urv","ryanbartlett-870-746486","https://www.imdb.com/user/ur48834556/?ref_=tt_urv","29 June 2018","That is about all you can get from it. From start to finish, you really are left wondering what the whole view on dinosaurs really is. Do we want to save them? Are we scared of them? Do we just get rid of the ""bad"" ones? Who knows. At the end of the day though, everyone in the movie is running and trying to survive these giant extinct monsters. I feel like the answer is very simple.
The movie passes a very dumb, very sequel plot line through with the thought that the audience would just love looking at the beautiful cg dinosaurs and not even notice anything else. However, in this day and age, great CG is expected not admired, and I wanted to walk out of the movie. There was way too many dramatic running sequences and a bad boring script that at one point had two adult strangers trying to persuade a little girl to come with them and to leave her family and everything she knows. Just so much left and right that was so not good that you almost couldn't look away, but actually it wasn't bad enough to even do that. 
Another sequel, another bomb. And I'm pretty sure they are still going to make another one. Please Chris Pratt, leave while you can!","36 out of 64 found this helpful."
"10","/10","DON'T LISTEN TO OTHER CRITICS!!!!!!!!!!!!!!!!!!!","https://www.imdb.com/review/rw4258130/?ref_=tt_urv","SnowLeopardMaster","https://www.imdb.com/user/ur87865549/?ref_=tt_urv","29 July 2018","This movie has been out for about a month and is already criminally over-hated/underrated. People will tell you that it adds nothing to the franchise, that it's scenes are stupid and unoriginal, and a bunch of other *censored*. All of them are wrong. This may be personal opinion, but this movie is genuinely thrilling, and it was worlds ahead of Jurassic World. Just go watch it. If you don't enjoy it, so be it. But I still think it's a great movie, and it didn't deserve a quarter of the hate it got.","62 out of 96 found this helpful."
"7","/10","A good movie....","https://www.imdb.com/review/rw4200422/?ref_=tt_urv","shahbazahmadit","https://www.imdb.com/user/ur62948474/?ref_=tt_urv","12 June 2018","A good movie not boring.. you can watch one time ..","2 out of 3 found this helpful."
"7","/10","Not great but solid","https://www.imdb.com/review/rw4216095/?ref_=tt_urv","coachwimbush","https://www.imdb.com/user/ur85586955/?ref_=tt_urv","26 June 2018","This movie is not great, but it's nowhere near as bad as some of the reviews I've read. Nonetheless I think it's worth watching at the theatre.","2 out of 3 found this helpful."
"7","/10","Good fun, although a bit long and the action is less exciting than it used to be. Still a nice watch, nothing great though.","https://www.imdb.com/review/rw4786425/?ref_=tt_urv","imseeg","https://www.imdb.com/user/ur84924605/?ref_=tt_urv","17 April 2019","Just good fun. It is an action movie and action is what you will get.Some of the older Jurassic Park movies had better action scenes though. The beginning of this movie starts out quite fastpaced and exciting though. Great action scenes in the beginning, but in the end there is just more of the same kinda tedious fighting with dinosaurs. I have seen all that a zillion times before, cant get really excited by those dino fights any more. But maybe / surely (?) kids could still love it if it is there first time they see a Jurassic Park picture, because it is slick, well made action blockbuster entertainment. For those who like this kind of stuff, enjoy...","2 out of 3 found this helpful."
"9","/10","Love it","https://www.imdb.com/review/rw4331135/?ref_=tt_urv","chinakids12","https://www.imdb.com/user/ur44483322/?ref_=tt_urv","10 September 2018","I love the story. And all the shots are very excited to watch. I can feel tense on them. I will love to see it twice or more.","92 out of 147 found this helpful."
"6","/10","Once again Claire and Owen team up, but this time to save dinosaurs from Isla Nublars destruction.","https://www.imdb.com/review/rw4196806/?ref_=tt_urv","pal05052003","https://www.imdb.com/user/ur57728530/?ref_=tt_urv","9 June 2018","There is not much story, or emotional investment in this movie. It feels like a Transformer's movie packed with dinosaurs. Unlike the previous instalment, where we see Claire undergo a character arc from career obsessed aunt to caring motherly aunt, this movie has none. However, Chris Pratt does get to do more than just run and gets more heroic action scenes. Bryce Dallas Howard does not enjoy much screen time (probably due to Pratt's star power) or any memorable scenes. The other human characters played by BD Wong and Jeff Goldblum are there just for continuity and provide continuity. Yet, there are spectacular actions scenes, and several dinosaur battles. So if you just want to enjoy spectacle over a popcorn, this movie is for you. But don't expect this flick to win any awards, be it in the technical or acting department.","2 out of 3 found this helpful."
"4","/10","How many times can they do this!","https://www.imdb.com/review/rw4268814/?ref_=tt_urv","shortythepimp-26852","https://www.imdb.com/user/ur80417913/?ref_=tt_urv","4 August 2018","How many times can they keep doing the same basic script about man made dinosaurs and the human greed? Same basic plot over and over. This one was probably the most lame of the franchise. Let the franchise go extinct already! The effects are only good part of the movie. But that's probably no surprise.","18 out of 29 found this helpful."
"10","/10","Ignore the hate and watch the movie.","https://www.imdb.com/review/rw4233738/?ref_=tt_urv","jonasbalck","https://www.imdb.com/user/ur83930957/?ref_=tt_urv","11 July 2018","ALRIGHT. I've seen a lot of different reviews, some rating high, some rating low. And the way I see it, those who gave it a bad rating either didn't understand the plot or the metaphor/moral of the movie, or is just complaining because they didn't get to be nostalgic about the old movies. In my perspective you can't rate a movie by comparing it to an older movie - this movie is nothing like the old JP's, but is that equal to the movie being bad? No.I liked everything in this movie. The acting, the characters, the CGI and the plot. It's both emotional, horrific and exiting - full of action and great scenes. I would advise the people who didn't like the movie to watch it an extra time - but this time consider what Dr. Malcolm(goldblum) actually was saying - and compare it to the real world. I can relate to each and every word of his, and the moral of what he's trying to tell is both tragic but very eye opening. So please, ignore the bad reviews and go watch the movie without speculating to much about it being exacly like the old movies. Enjoy the movie as it is, and appreciate the art of this fantastic movie. And for those wondering - no, I do not hate the old movies, in fact those are some of my favorite movies of all time.","99 out of 159 found this helpful."
"7","/10","A darker and more ambiguous entry in the dino franchise","https://www.imdb.com/review/rw4375797/?ref_=tt_urv","sedenhansen-61849","https://www.imdb.com/user/ur66584934/?ref_=tt_urv","4 October 2018","Picking up three years after the previous film, the story starts with Isla Nublar, now abandoned to the jungle and the dinosaurs, imperiled by an erupting volcano. People in America are debating whether to rescue the dinosaurs form the island or not. Clare and Owen, who have gone their separate ways between the films, are reunited in a privately financed effort to rescue the dinosaurs instigated by an old associate of John Hammond. Joined by a couple of workers from Claire's ""save the dinosaurs"" group (who seem rather a copy of the control room quasi-couple from the previous film), they travel with a group of soldiers-of-fortune to the island and start rounding up dinosaurs as the volcano rumbles. Unsurprisingly (though surprisingly quickly), nasty ulterior motives emerge, and the characters find themselves fighting for their lives, those of the remaining dinosaurs, and their own moral compasses. 
 The film is chock -full of references to earlier films in the franchise, which are fun to mentally tick off, and the audience is usually a step or two ahead of the action (what successes or setbacks will happen during the several escape efforts is usually easy to figure out). The film has an odd and uneasy relationship with violence; dinosaurs are seen dispatching humans in grisly ways, but person-to -person violence is handled squeamishly if at all. The filmmakers swing between a story of awed fascination and mortal terror, between clear-cut conflicts and moral ambiguities. Ultimately, the film can't quite decide on a tone or message as it zig and zags about the issue of the perils of the ever-expanding possibilities of science.","2 out of 3 found this helpful."
"6","/10","Nothing really new","https://www.imdb.com/review/rw8279218/?ref_=tt_urv","xandran-65847","https://www.imdb.com/user/ur154088754/?ref_=tt_urv","27 June 2022","While it doesn't really add to anything new to the story, Fallen Kingdom is a good enough sequel that doesn't completely rile on CGI and focuses a bit more more the characters.","1 out of 1 found this helpful."
"8","/10","The 2nd best of the series","https://www.imdb.com/review/rw4395106/?ref_=tt_urv","mendola","https://www.imdb.com/user/ur34164645/?ref_=tt_urv","13 October 2018","I don't get why people are fussed about the ""reality"" of the movie, this is not a Discovery Channel documentary, it's a adventure science fiction movie, get over it. Very enjoyable.","36 out of 53 found this helpful."
"6","/10","Has plenty of heart, but is slightly lacking in the excitement stakes","https://www.imdb.com/review/rw9091612/?ref_=tt_urv","jimbo-53-186511","https://www.imdb.com/user/ur26154754/?ref_=tt_urv","31 May 2023","Three years after the events from Jurassic World the dinosaurs are now freely roaming round on Isla Nublar. When Claire learns that the dinosaurs lives are in jeopardy on Nublar she enlistens the help of raptor wrangler Owen in a daring mission to save as many of the dinosaurs as possible. However, it seems that the island itself isn't the only threat to the dinosaurs...In terms of overall cinematic greatness, Fallen Kingdom does seem to be one of those films that gives with one hand whilst simultaneously taking away with the other. Naturally, this produces a sequel that provides mixed results...To begin with the good then it's fair to say that this is quite an interesting story and is a nice expansion of the events that were depicted in the first film. It contains some moving moments and it's fair to say that the film has a lot of heart as well. Some may say that it goes overboard with the mush, but I think the film rides its luck just on the right side of acceptable in this respect.The downside of all of what I've mentioned is, that due to the weightiness of the more serious story, Fallen Kingdom lacks some of the charm and fun that was much more abundant in the previous film. Pratt and Howard had a great working chemistry in the first film that isn't quite as strong in this film. It also has to be said that this sequel is not quite as exciting or as fast-paced as the first film. It is saved though by some of the acting (particularly Spall who was the one that stood out for me).Despite some of its problems though it is still a much better film than Dominion and as I've already said despite it not being quite as exciting or fun as its predecessor it does have an interesting story which does compensate slightly for some of its weaker areas.Not perfect by any means, but far from the worst in the series (and I'm counting both sets of franchises here).","1 out of 1 found this helpful."
"8","/10","Still good","https://www.imdb.com/review/rw5008994/?ref_=tt_urv","saimyathtut","https://www.imdb.com/user/ur105708235/?ref_=tt_urv","21 July 2019","If you like Jurassic Franchise you will like it .Dinosaur Cgi is amazing.","82 out of 130 found this helpful."
"5","/10","Don't bother....too late, you've already seen it .","https://www.imdb.com/review/rw4221280/?ref_=tt_urv","stormbringers","https://www.imdb.com/user/ur10021794/?ref_=tt_urv","30 June 2018","Had a reasonable expectation that this would be a good film as I enjoyed the first JW.....but I was more deflated than a paddling pool full of nails after watching it. There were no surprises, the tension never reached higher than 'laughable' and most of the dinosaur 'stars' seemed to be as much in the dark as the audience.....and talking of dinosaurs, it's as well they are CGI as not one of them would've signed up after reading the script. I suspect the human stars felt the same until the pay cheque was waived in front of their agents. 
Come back Colin Trevorrow...all is forgiven.","20 out of 33 found this helpful."
"6","/10","Big roar from the new entry, but is it enough?","https://www.imdb.com/review/rw4710235/?ref_=tt_urv","joebloggscity","https://www.imdb.com/user/ur2790158/?ref_=tt_urv","9 March 2019","There's lots of cliches that you can use for this film, involving extinction etc. The last movie was mostly met lukewarm by many, but I enjoyed, yet really it's the same thing over again. This film had to try to be different, and does it succeed? Yes & No.What we have is again a similar enough background, with heroes and comic book villains, thrust into chaos with dinosaurs on the loose. The difference? Well not too much, but it's more low key as most of the action is not on the dinosaur island with large crowds etc, but still it's bish bosh dino v dino action.The story is fine, and it's enjoyable, and as ever the CGI is amongst the best anywhere. However, they really are stuck for ideas. You can see that have made some changes to move it all in another direction, but really they end up falling back into the old school.It's a fine film, deserved better reviews from many, but sit back and have fair expectations and you'll enjoy the ride. It will bring the inner kid in you, and some of you may still want to jump behind the sofa!","1 out of 1 found this helpful."
"7","/10","Maybe too wild","https://www.imdb.com/review/rw8284066/?ref_=tt_urv","griffithxjohnson","https://www.imdb.com/user/ur96222659/?ref_=tt_urv","28 June 2022","Completely off-the-rails writing but it's just wild enough to work. Absolutely spectacular special effects & cinematography. But the characters are shallow & just in place to move the plot forward.","1 out of 1 found this helpful."
