"rating-other-user-rating","point-scale","title","title href","display-name-link","display-name-link href","review-date","text","actions"
"1","/10","This movie is worse than The emoji Movie","https://www.imdb.com/review/rw4194277/?ref_=tt_urv","nadoglover","https://www.imdb.com/user/ur77766401/?ref_=tt_urv","7 June 2018","This movie will make you feel like you want to kill yourself with your own keys to end your misery.
its torture dont watch it, its so cliche and easy to predict there are so many characters that you can remove from this movie and it will not change the plot or the flow of the movie.
they have a character that is meant to be the funny and in the entire movie you just want to see him die in a horrible way because he is just horrible.
the movie is just bad writing.
a really bad and dissapointing movie people just walk out of the cinema at midst of the movie.
DONT WASTE YOUR MONEY, GO WATCH DEADPOOL 2 INSTEAD","23 out of 51 found this helpful."
"10","/10","Fantastic movie","https://www.imdb.com/review/rw4194874/?ref_=tt_urv","nidhishmnair","https://www.imdb.com/user/ur88948092/?ref_=tt_urv","8 June 2018","Loved this movie from start to climax....loved the performance of bryce and chris pat...they are lovely pairThis film has everything.....funny moments,real action,fantastic VFX,performance,scary scenes and sentimental scenes (better than Jurassic world and almost par with Jurassic park 1)i will give this film 100% score...ie, 10/10","146 out of 247 found this helpful."
"7","/10","Good overall but plot suffers","https://www.imdb.com/review/rw4217077/?ref_=tt_urv","dangaskins13","https://www.imdb.com/user/ur51747026/?ref_=tt_urv","27 June 2018","A pretty good movie, great effects and there are a lot of intense moments and suspense. The plot suffers because they have to set up the next movie, so every time the characters have a chance to do something smart, they do the thing that sets up Jurassic World 3. Still, it's a good summer popcorn flick that is fun and will keep you on edge 90% of the movie.","1 out of 10 found this helpful."
"1","/10","Absolutely Awful.","https://www.imdb.com/review/rw4248992/?ref_=tt_urv","dannyta","https://www.imdb.com/user/ur23048655/?ref_=tt_urv","22 July 2018","As stupid as a dinosaur smiling and pretending to be asleep sounds sums up this entire movie. Worst one of the whole franchise","21 out of 46 found this helpful."
"7","/10","If you liked the first 4 films in this series, you'll like this one","https://www.imdb.com/review/rw4213147/?ref_=tt_urv","bankofmarquis","https://www.imdb.com/user/ur10919398/?ref_=tt_urv","23 June 2018","Did you watch - and enjoy - the other 4 films in the JURASSIC PARK series? If so, then you'll enjoy the 5th installment, for it is more of the same - man's hubris causes giant animals to run amok and chaos, death and destruction ensues.The plot of this film is simple enough - the island where JURASSIC WORLD was built is now in trouble as a dormant volcano is now dormant no more. The debate rages - should Man go to the island to save the Dinosaurs trapped there - or should they let nature take it's course (again). Some nefarious fellows - who's intentions don't seem to be as pure as we are led to believe - convince our heroes from the previous film, Claire and Owen to help ""save"" the dinosaurs.But, of course, the plot is just an excuse to get some pretty awesome looking CGI Dinosaurs on the screen - and to put our heroes in peril. And on that score, this film succeeds wonderfully well.I remember back in 1993 how awed I was at the spectacle on the screen. The CGI Dinosaurs were LIFE-LIKE! I was blown away by it. Today, I have come to expect the CGI will be top-notch - and I was not disappointed, to the point where I forgot that I was watching CGI.As for the action and acting, Director J.A. Bayona (A MONSTER CALLS) keeps things moving along at a sprightly pace, not letting us catch our breath - or more importantly - stop to think of the plausibility or logic of decisions being made. His mantra seems to be ""move our heroes from peril to peril"" - and he does that well.Chris Pratt is back as Owen, the ""Raptor handler"" and his charm and charisma on screen is in full display and really carries the weight of this film. He is able to charm his way into the audiences heart, so you end up rooting for him fully from start to finish. Bryce Dallas Howard (daughter of ""Opie Cunningham"" Ron Howard) comes into her own as Claire, the Dinosaur ""Scientist"" and quasi-love interest for Owen. She is able to avoid (mostly) the cliches of ""damsel in distress"" or ""kick-ass chick"" and gives us a rounded character that I rooted for just as strongly as Pratt's character.The rest of the cast - save two - are pretty much throw away that are set up to be Dinosaur food. The two that stood out are the great James Cromwell as an aging Billionaire who has a connection to the originator of Jurassic Park, John Hammond. Cromwell is his usual, solid self. And...the funniest character in the film...computer expert Franklin Webb (played by Justice Smith) who, of course, is asked to do more than just ""computer stuff"" that he is ill-equipped to handle.Going into this film, you know what you are going to get - and this film delivers that entertainingly enough. As I stated at the top, if you like the first 4 films of this series, you'll like this one.Letter Grade: B+7 1/2 (out of 10) stars and you can take that to the Bank(ofMarquis)","1 out of 10 found this helpful."
"","","What..","https://www.imdb.com/review/rw6667259/?ref_=tt_urv","JWick23","https://www.imdb.com/user/ur100048372/?ref_=tt_urv","6 March 2021","This was a bogus movie. The story barely made sense, the writing was poor, and the characters were super annoying. Though it had very good visuals and sound choices but those two characteristics alone don't complete a flim.This was basically a recycled version of the prequel pretty much with more cliches and a predictable plotA waste of time..","3 out of 18 found this helpful."
"7","/10","Danger: Adrenaline Up! Park In Ruins! Explosion Imminent!","https://www.imdb.com/review/rw4218364/?ref_=tt_urv","valen060","https://www.imdb.com/user/ur5052414/?ref_=tt_urv","28 June 2018","Following from the success of Jurassic World, this is an intense movie where the stakes are higher than before and interesting twists that grow even more intriguing. My adrenaline kept going up as I witnessed Chris Pratt and Bryce Dallas Howard return as the lead roles Owen and Claire, while they take on another challenge in the ruins of the abandoned theme park.Three years have passed and with a volcanic eruption imminent on Isla Nublar, it's up to former park employees Owen and Claire to take on their newest challenge: Rescuing as many roaming dinosaurs and getting them to safety. But for Owen, it's about finding the last surviving Velociraptor he personally raised, Blue. As before, this also attracts attention of corrupt individuals willing to use these dinosaurs for nefarious purposes as well as encountering a new species of dinosaur never seen before.Director J.A. Bayona definitely painted a darker picture in the Jurassic Park universe. Story-wise, I say this latest installment is basically a dark clone to its 1997 predecessor The Lost World. And the return of Jeff Goldblum as Dr. Ian Malcolm was worthwhile and a nice touch to said film, but I kind of wished his role was expanded more than given here. James Cromwell's role as Ben Lockwood is an interesting person with his ties to the late founder of Jurassic Park John Hammond. Given Chris Pratt's reputation in action-adventure films, his performance kept me on the edge of my seat as I simply just picture him as Star Lord on a separate, solo mission. I know there's still a sequel film on the way following from this and judging by what the end result of the movie had shown, it feels unfinished. The story comes in short supply, but the performances were more than enough to keep an open mind.","1 out of 12 found this helpful."
"4","/10","Back to life","https://www.imdb.com/review/rw4257826/?ref_=tt_urv","Prismark10","https://www.imdb.com/user/ur4569900/?ref_=tt_urv","29 July 2018","Dr Ian Malcolm (Jeff Goldblum) was right at the beginning of this movie. Let dinosaurs be extinct for a second time. In a similar vein the Jurassic Park franchise has run out of gas.Set three years after the destruction of Jurassic World. Isla Nublar is facing catastrophe as the dormant volcano becomes active and threatens to destroy all the creatures on the island.Claire (Bryce Dallas Howard) is fighting to save the dinosaurs by trying to get political support. She is hired by a wealthy former business associate of John Hammond to rescue the dinosaurs and place them in another island where they could live in an isolated environment.However the company's chief officer Eli Millis (Rafe Spall) has another plan up his sleeve to auction off the rescued dinosaurs and create genetically enhanced dinosaurs as military weapons.Owen (Chris Pratt) is persuaded by Claire to return to Isla Nublar for the rescue which quickly goes wrong.Whereas Jurassic World was a retread of Jurassic Park, this one has the basic story of The Lost World: Jurassic Park which was never that good.The first half is set on Isla Nublar, the second part is set in a country mansion that looks like it is in England than California.The plot is just plain daft, it makes no sense whatsoever and contradicts previous films.","15 out of 31 found this helpful."
"10","/10","People are so hard to pleased.","https://www.imdb.com/review/rw4199014/?ref_=tt_urv","khchuang","https://www.imdb.com/user/ur89035527/?ref_=tt_urv","11 June 2018","I watched the movie and came here to read the feedback. Oh my gosh, there are so many negative comments. What you expect when you are watching a dinosaur movie? For me I like the simple story line, the look-real dinasours, and the compacted action scenes. There is no time for you to take a break for toilet during the movie. Before this my intention is to watch first prior to bring my kids. But I think the movie could be too scary for them.","151 out of 256 found this helpful."
"7","/10","Ignore The Haters. Just Read This Review.","https://www.imdb.com/review/rw4214724/?ref_=tt_urv","Movie-ManDan","https://www.imdb.com/user/ur31261952/?ref_=tt_urv","24 June 2018","The second instalment of the 'Jurassic' continuation saga is one of the most dividing films of the year. Some find the dopiness overshadowing the good while others are too impressed with the visuals to knock it. Well I am here to say all the people that bash this are simply wrong. Trashing a movie with such great qualities like great visuals and exciting danger just makes you sound more like an idiot than a film expert. Those that gave it a warm or normal thumbs down for this are more trustworthy.Back in the fun are Bryce Dallas Howard and Chris Pratt. We have grown to love them since the first, so we really don't want anything to happen to them. Rich evil scientists try to take the dinosaurs off the island (which is in really bad shape) and make money off of them, but Howard and Pratt want them to live in peace. Right away, this is a pretty dumb storyline. All the other instalments deal with the fact that humans and dinosaurs cannot coexist. Dinosaurs can cause so much destruction and can easily extinct humans. Pratt and Howard don't want any of them to die? Give me a break. The scientists wanting to make money off of them is downright silly and the most annoying element. And that is mostly who we deal with aside from the two heroes. So yes, there are flaws that prevent this movie from being great.But there are true redemptive elements that are a ton of fun. Like all the others, the dinosaurs look real. That alone is a plus. Here, they run rampant and cause way more mayhem than usual. The look and style of some of the dinosaurs have been made to look more badass and simply more awesome. Anybody that does not like to see realistic dinosaurs in action, I ask this question: ""Are we at that point in society where seeing a dinosaur is as trivial as seeing a dog?""A spark of originality in these dinosaurs is that they are basically anti-heroes. There is a total of three characters in the entire movie that we like (Howard, Pratt, and James Cromwell's granddaughter) other than that, we would rather see these prehistoric creatures open up a can of whop-ass on the cast. When they do, it is awesome. Annoying characters we want gone are destroyed by amazing creatures. Is that not great? Is that not what you wanted? As long as they leave the three alone, seeing them cause carnage to dopes we don't like is a real treat. And all of which is done in very impressive feats. NOBODY can deny how amazing these prehistoric creatures looked and how awesomely directed the entire thing was. The mayhem on the rise caused further excitement and even admiration for the crew in just how impressive this sheer creation was.So is 'Jurassic World: Fallen Kingdom' great? No. There are simply too many heavy flaws that prevent this from reaching an overall high quality. However, I ask you to please not overlook the strengths this movie has. Many of them cleanly overpower the weaknesses.3/4","1 out of 13 found this helpful."
"10","/10","The first chapter has officially ended","https://www.imdb.com/review/rw4230639/?ref_=tt_urv","jewelofbeauty","https://www.imdb.com/user/ur89834036/?ref_=tt_urv","8 July 2018","What's with the haters? This movie was great and really followed through with the logical next step. I'm not sure what the nay sayers expected, but who cares? I loved the movie and the nostalgic elements in it. The storyline itself was reasonable and considering the world we live in now, not that far fetched. JW2 has put an end essentially to the story of its predecessors to open the path to a new, very different and scarier direction. If people couldn't handle this movie, will they be able to handle what's coming next?","128 out of 215 found this helpful."
"6","/10","Ok sequel but worse than jurassic world(2015)","https://www.imdb.com/review/rw4249818/?ref_=tt_urv","diazmanuel836","https://www.imdb.com/user/ur51345776/?ref_=tt_urv","23 July 2018","This film was ok but it could have been better,when i saw jurassic world(2015)i didnt expect anything and i had a good time but because of that i expected this movie to be as good as the last one,i was sadly disappointed because this movie was full of cliche characters,lazy writting and predictable ending i hope the third one gets better or at least as good as the first one","1 out of 15 found this helpful."
"","","Omg!","https://www.imdb.com/review/rw5830306/?ref_=tt_urv","gnegredo","https://www.imdb.com/user/ur71026795/?ref_=tt_urv","16 June 2020","Don't believe the 8-10 ratings. Total nonsense. Please stop making these movies anymore and start something new cause now it's getting boring.","2 out of 11 found this helpful."
"6","/10","Good, but not as good as the first Jurassic World","https://www.imdb.com/review/rw4194772/?ref_=tt_urv","sideshowbob-07653","https://www.imdb.com/user/ur62788935/?ref_=tt_urv","8 June 2018","I haven't written this immediately after watching the film. I've slept on it to properly digest it so here's what I think. The film itself is decent enough, I'm a big fan of all the films (even the bemoaned JP3) and this one sits itself along the others quite well. 
I loved the first one, brilliant entertainment, Owen the swashbuckling hero and Claire the corporate employee who did everything by the book and wanted to preserve the company and generate profit above all else. It was a rollercoaster of a film and had all the elements you'd want from a Jurassic Park film (albeit with some ""suspend your disbelief"" moments)This film, however, still has some elements of the first one but has become slightly darker. The light hearted humour moments and one liners are rarer and the film seems intent to become more sensible and tell a more moral story rather than be more lighter entertainment. 
The film goes at a good pace with some good set pieces that you'd come to expect and the 2 odd hours flew by but I couldn't help, as much as I liked it, that it was missing something. The new director for this and I assume for the 3rd instalment has his own ideas on telling the story which is all good but this film feels different to the first, not in a good or necessarily bad way, but it'll make the trilogy feel a bit disjointed. The main protagonist Mills (Rafe Spall) doesn't convince as the main ""bad guy"" for me. He seemed very one dimensional and a bit wooden, his character never developed and maybe it should have been a little bit. Overall it's a good film and I took my 6 year old son and he enjoyed it but it left me a bit wanting. I hope the third one is an improvement. 6.5/10 for me","0 out of 2 found this helpful."
"6","/10","Same Old Story?","https://www.imdb.com/review/rw4211505/?ref_=tt_urv","nikcoppin","https://www.imdb.com/user/ur89333295/?ref_=tt_urv","22 June 2018","Jurassic Park: Fallen KingdomWe've seen them running around a park in an island, then San Diego and then another park on an island, which was called a world, and now they are having a jolly old time running around an old blokes big house.That old bloke being John Hammond's original partner that we knew nothing about. I wonder going forward how many other secret partners David Attenborough's dearly departed brother is going to have had that get thrown in to support the latest plot idea.Speaking of David Attenborough, I wonder what he would think of what his brother did in making all these creatures de-extinct as is the phrase coined in this movie? However he referred to them, Morrissey would probably have a problem with it. But then he is an animal that should have become extinct years ago himself.So, the blind girl from The Village has split up with Star Lord, but needs his help to go and rescue a load of dinosaurs from a volcanic island that is about to explode. Yes, the old completely incompatible couple that get together, then conveniently have split up before the next movie, then we discover they still really like each other and all that business.We have the completely predictable story of people messing with things they shouldn't be messing with and they all go out of control. Again. No matter how many times the Grandmaster Ian 'Chaos Theory' Malcolm tells them, they just won't listen. No wonder he just disappeared to his own planet to promote and enjoy superfights between various space creatures and animated rock formations with Kiwi accents and of course, Hulk v Thor.We also have the renegade child running around the place getting saved and looked after by the in-love/not-in love/in-love-again incompatible couple as seems to be standard in this and similar franchises. Although there is a secret about the child that turns out to be an interesting little twist in the movie that is a nice little addition to proceedings.Then of course some of the dinosaurs have to have their little handbags at dawn fights and Blue and the ever-popular T-Rex have their little grandstanding heroic moments. Yep, it's all pretty standard and in fear of getting a bit like the Star Wars franchise. A watchable summer blockbuster, but far from being up there with others in the franchise and really nothing to write about.Oh, wait....","0 out of 0 found this helpful."
"4","/10","Jurassic World Fallen Kingdom: Time to go back to the drawning board","https://www.imdb.com/review/rw4264771/?ref_=tt_urv","Platypuschow","https://www.imdb.com/user/ur57590728/?ref_=tt_urv","2 August 2018","Critically slammed by the critics but praised by fans, so what did I think of it?I've soured on Chris Pratt, like really quite badly so. From him simply being in too much and being the ""Current big thing"" to his vocalising his love for trophy hunting like a mentally deficient human being to his recent magical cloud man speech at an awards show. I'm burnt out on his presence and detest seeing such a vile human being on my screen, so understandably that did damage Fallen Kingdom for me.With yet another excuse why they absolutely had to go back to an island full of man eating dinosaurs this standard cliched Hollywood tripe see's our heroes trying to save the giant reptiles from a volcano. It's big, it's flashy, it's loud, it's dumb, it's predictible and it's a genital slap around the face that they paid over 170 million for something so entirely devoid of originality.For me the order of JP films from best to worst would now be 1, 2, 4, 5, 3 and I'm under the firm belief after seeing this that they badly need to go back to drawing board and either rethink the strategy or cease making them (As in REALLY cease, not wait a few years and reboot).Seen it all before and though the finale is interesting, it raises questions that ultimately make the whole concept unbelievable.The Good:A couple of interesting ideasBlueThe Bad:GoldblumThat one scene when the Volcano erupts, screw you writersNo originalityGeneric Hollywood nonsenseChris PrattThings I Learnt From This Movie:Acts of god are the will of god and therefore we won't do anything about them............except all the times we do, but then it's different.If you need to kill something for pleasure, start with yourselfEngage with reality, there are NO gods. I mean okay I already knew that, but how do billions not?!","10 out of 19 found this helpful."
"10","/10","Great movie!!","https://www.imdb.com/review/rw4224509/?ref_=tt_urv","tim-725-177816","https://www.imdb.com/user/ur44655326/?ref_=tt_urv","3 July 2018","Was 2 hrs of a great movie and a great story! Absolutely loved it on IMAX.","85 out of 139 found this helpful."
"6","/10","Decent movie but repetitive","https://www.imdb.com/review/rw4368758/?ref_=tt_urv","mrkingarthur1980","https://www.imdb.com/user/ur42765154/?ref_=tt_urv","30 September 2018","It's a decent movie if you never saw the first three Jurassic Park movies. Too many of the scenes are repetitive and lack any originality. The plot is very bad and lack any sense. When you watch the movie it's almost like you are watching a remake of Lost World Jurassic Park.","0 out of 1 found this helpful."
"10","/10","Superb!!!","https://www.imdb.com/review/rw4195655/?ref_=tt_urv","s_ramsaran","https://www.imdb.com/user/ur29421564/?ref_=tt_urv","8 June 2018","Awesome movie! I really enjoyed it. Of course some things could be beter, but the story with the dark big house was a different setting. Also the movie starts with action. Cant wait for Jurassic World 3!!!","161 out of 274 found this helpful."
"6","/10","A fifth Jurassic movie","https://www.imdb.com/review/rw5959565/?ref_=tt_urv","JayPatton88","https://www.imdb.com/user/ur67826053/?ref_=tt_urv","1 August 2020","The franchise keeps putting films out; all enjoyable none award winners. But good enough for a movie to watch with the family and gear no complaints.","0 out of 0 found this helpful."
"","","Is the whole world headed towards another dinosaur domination?","https://www.imdb.com/review/rw4365771/?ref_=tt_urv","TxMike","https://www.imdb.com/user/ur0438066/?ref_=tt_urv","28 September 2018","My wife and I watched this at home on DVD from our public library, the picture and sound are both first-rate, especially if you are listening in a surround sound environment.Three years ago we saw that the Jurassic theme park had to be shut down. The various dinosaurs have been left to live on their own little island. But now the dormant volcano is erupting, predictions are that it will be an extinction event for the dinosaurs. Unless some of them can be moved out to a safer place.There are some hearings, some want to ""protect"" the dinosaurs, even though they are not there naturally, some want to just let nature take its course, let them die.Chris Pratt as Owen Grady is content to be off in the wilderness building his camp when he is approached. It is old flame, Bryce Dallas Howard as Claire Dearing, who pleads with him to join her in an expedition paid by a private group to relocate some of them to a different remote island. He reluctantly agrees.The meat of the story is the deception, the wealthy group doesn't intend to simply relocate the dinosaurs, they want to capture them to do research to develop species they can weaponize and sell for millions.There is more and more action as the movie moves along, some scenes similar to the older Jurassic movies where a raptor of some sort is hunting down people and they, usually, narrowly escape. Not a great, high-concept movie but suitably entertaining for 2 hours.","1 out of 4 found this helpful."
